{
  "schemaVersion": 1,
  "id": "custom-office-001",
  "name": "My Office Buddy",
  "style": "cute-3d",
  "source": "manual",
  "appearance": {
    "base": "adult-neutral-01",
    "skinTone": "medium",
    "hairStyle": "short-wavy",
    "hairColor": "dark-brown",
    "outfit": "blue-shirt-jeans",
    "shoes": "white-sneakers",
    "accessories": ["glasses"]
  },
  "animations": {},
  "personality": "friendly",
  "license": "user-created"
}
